{
  "schema": "afi.pipeline.v1",
  "pipelineId": "proof-sequential-multi-category",
  "pipelineVersion": "v1.0.0",
  "description": "CONFORMANCE FIXTURE (non-production): two categories in strict sequence (technical then pattern) before the scorer — explicit dependency ordering, no concurrency.",
  "entry": "technical",
  "nodes": [
    {
      "id": "technical",
      "category": "technical",
      "pluginId": "afi-analysis-technical",
      "pluginVersion": "1.0.0",
      "config": { "candleLimit": 100 }
    },
    {
      "id": "pattern",
      "category": "pattern",
      "pluginId": "afi-analysis-pattern",
      "pluginVersion": "1.0.0"
    },
    {
      "id": "scorer",
      "category": "scorer",
      "pluginId": "afi-scorer-froggy-trend-pullback",
      "pluginVersion": "1.0.0"
    }
  ],
  "edges": [
    { "from": "technical", "to": "pattern", "fromPort": "candles" },
    { "from": "pattern", "to": "scorer" }
  ]
}
