{
  "schema": "afi.pipeline.v1",
  "pipelineId": "proof-branch-deterministic-join",
  "pipelineVersion": "v1.0.0",
  "description": "CONFORMANCE FIXTURE (non-production): a fan-out branch (pattern + sentiment) closed by a multi-parent join that is deterministic by construction (mandatory strategy + conflictRule) — branch completion order can never change the merged value.",
  "entry": "technical",
  "nodes": [
    {
      "id": "technical",
      "category": "technical",
      "pluginId": "afi-analysis-technical",
      "pluginVersion": "1.0.0"
    },
    {
      "id": "pattern",
      "category": "pattern",
      "pluginId": "afi-analysis-pattern",
      "pluginVersion": "1.0.0"
    },
    {
      "id": "sentiment",
      "category": "sentiment",
      "pluginId": "afi-analysis-sentiment",
      "pluginVersion": "1.0.0"
    },
    {
      "id": "merge",
      "category": "merge",
      "pluginId": "afi-merge-enriched-view",
      "pluginVersion": "1.0.0",
      "join": {
        "policy": "all",
        "merge": { "strategy": "namespace-by-node", "conflictRule": "error" }
      }
    },
    {
      "id": "scorer",
      "category": "scorer",
      "pluginId": "afi-scorer-froggy-trend-pullback",
      "pluginVersion": "1.0.0"
    }
  ],
  "edges": [
    { "from": "technical", "to": "pattern" },
    { "from": "technical", "to": "sentiment" },
    { "from": "pattern", "to": "merge" },
    { "from": "sentiment", "to": "merge" },
    { "from": "merge", "to": "scorer" }
  ]
}
